Id,permalink,username,to,date,retweets,favorites,mentions,hashtags,geo,text
1256010404863471617,https://twitter.com/joedigregorioMS/status/1256010404863471617,joedigregorioMS,,2020-04-30 23:59:50+00:00,0,0,,,,"“What is that next Neil Armstrong moment? That one small step for man moment? There could be multiple ones.” Global Head of Auto and Shared Mobility, Adam Jonas explains the new space economy in a Morgan Stanley Minute. "
1256009671564881920,https://twitter.com/gokalptahmaz/status/1256009671564881920,gokalptahmaz,ErkinSahinoz,2020-04-30 23:56:55+00:00,0,1,,,,"Ah Erkin hocam ahh size hic yakistiramadim .... Benzer seyleri, Kaan Sariaydin da soyluyor Morgan Stanley eski calisani, odami yalan dolan ? Neyse siz zaten alayima muhaliftiniz unutmusum."
1256009481042817024,https://twitter.com/KunklerKkunkler/status/1256009481042817024,KunklerKkunkler,MAKERSwomen,2020-04-30 23:56:10+00:00,0,2,@MorganStanley @ArlanWasHere,#Inspired #Rockstar,,Highlight of the @MorganStanley Multicultural Leadership Symposium last year was hearing your story @ArlanWasHere #Inspired #Rockstar
1256009191216549891,https://twitter.com/EpochTimes/status/1256009191216549891,EpochTimes,,2020-04-30 23:55:01+00:00,33,43,@MSCI_Inc,#CCP #NationalSecurity #HumanRights,,"Morgan Stanley Capital International (@MSCI_Inc), one of the largest index providers in the world, has no plans to adjust its global indexes to exclude companies owned by the #CCP regime, despite mounting concerns over #NationalSecurity and #HumanRights."
1256009181309603842,https://twitter.com/ChuckOdinJr/status/1256009181309603842,ChuckOdinJr,ChloeSalsameda,2020-04-30 23:54:59+00:00,0,0,,,,"Similarly, such Wall Street firms as Goldman Sachs & Morgan Stanley should be ashamed of themselves as the Investor Relations agencies of the Chinese Communist Party under the cover of the “People’s Republic of China”. "
1256007585666220032,https://twitter.com/fco_javier_a/status/1256007585666220032,fco_javier_a,,2020-04-30 23:48:38+00:00,0,0,,,,Morgan Stanley Nike Oracle PepsiCo Pfizer Progressive Starbucks Susan G. Komen Tostitos Unilever United Way Verizon Wells Fargo
1256006671949676545,https://twitter.com/ShawnMooreMS/status/1256006671949676545,ShawnMooreMS,,2020-04-30 23:45:00+00:00,0,0,,,,Congratulations to my partner Marie A. Moore and all the amazing Morgan Stanley women named to Forbes’ 2020 Top Women Wealth Advisors ranking. I am so proud of her. #1 in TX! 
1256000296041447425,https://twitter.com/donaldplawson/status/1256000296041447425,donaldplawson,GemmaActon,2020-04-30 23:19:40+00:00,0,0,@MorganStanley,#ausbiz,,Some might even say a hurricane is forming — and it already has a name 'Q2' Whatever happens the world economy is sure to look different @MorganStanley #ausbiz
1256000275183284226,https://twitter.com/caesars420/status/1256000275183284226,caesars420,,2020-04-30 23:19:35+00:00,0,0,,,,DraftKings Draws Overweight Rating From Morgan Stanley - TheStreet. $dkng
1255994689049767936,https://twitter.com/drpavito1/status/1255994689049767936,drpavito1,Arafunche11,2020-04-30 22:57:23+00:00,0,1,,,,"Noticia encontrada hace un rato, Morgan Stanley ko suele fallar en sus predicciones , asi que me temo que vamos a tener un dato muy en esa linea "
1255994423319711745,https://twitter.com/Chapapote6/status/1255994423319711745,Chapapote6,dlacalle,2020-04-30 22:56:20+00:00,0,0,,,,Hay previsiones de Morgan Stanley de que nos vamos a -14% y cinco años de recuperación como poco
1255991553149059077,https://twitter.com/CounterBlncNews/status/1255991553149059077,CounterBlncNews,,2020-04-30 22:44:56+00:00,0,0,,#PaycheckProtectionProgram #PPPLoans,,"Question of the day (4 of 5) According to data collected by Morgan Stanley, the U.S. government allocated at least _____ of the total $349 billion #PaycheckProtectionProgram loans to publicly traded companies. #PPPLoans https://www.counterbalanced.io/archive_20200421.html?ref=twitter"
1255988733901340674,https://twitter.com/ONAN_OUS/status/1255988733901340674,ONAN_OUS,,2020-04-30 22:33:43+00:00,0,8,,,,"Think of it as buying a bond from Morgan Stanley that pays coupons. But the coupons aren’t actually coupons: they’re digital options. If any index it is linked to goes below 70% of the initial value when the note was issued, you don’t get paid a coupon."
1255988302508785664,https://twitter.com/ONAN_OUS/status/1255988302508785664,ONAN_OUS,Chris_Whittall,2020-04-30 22:32:01+00:00,22,110,,,,Everyone seems to be commenting on this so let’s pick apart an actual structured product: a worst-of autocallable from Morgan Stanley https://www.morganstanley.com/structuredinvestments/docs/prospectus/prelim/ProspectusRed61770FY42.pdf
1255988093611462657,https://twitter.com/MatthewLeydenMS/status/1255988093611462657,MatthewLeydenMS,,2020-04-30 22:31:11+00:00,0,0,,,,"Bjarne Stroustroup created C++ as a versatile tool that wouldn’t just meet his immediate needs as an engineer, but could also be endlessly adapted for other applications. Here’s the Secret Engine of Everything in a Morgan Stanley Minute. "
1255987714664607745,https://twitter.com/Chrisgebb/status/1255987714664607745,Chrisgebb,,2020-04-30 22:29:40+00:00,0,0,@MorganStanley @POTUS,,,@MorganStanley @POTUS That's a lie
1255985916893593602,https://twitter.com/CompanyNewsHQ/status/1255985916893593602,CompanyNewsHQ,,2020-04-30 22:22:32+00:00,0,0,,,,Federal Reserve extends comment period for Morgan Stanley’s pending E*Trade acquisition 
1255985903459237888,https://twitter.com/GoldmanSachBOT/status/1255985903459237888,GoldmanSachBOT,,2020-04-30 22:22:29+00:00,0,0,,,,"Morgan Stanley (MS) surprised the market with Q2 result. Goldman Sachs changed the rating to Outperform, as Morgan Stanley (MS) reported a net revenue that soared 7%."
1255984498086477827,https://twitter.com/dakotafinancial/status/1255984498086477827,dakotafinancial,,2020-04-30 22:16:54+00:00,0,0,,,,Automatic Data Processing $ADP PT Raised to $147.00 at Morgan Stanley http://dakotafinancialnews.com/?p=1847021
1255984092342112256,https://twitter.com/stocknewstimes/status/1255984092342112256,stocknewstimes,,2020-04-30 22:15:17+00:00,0,0,,,,Automatic Data Processing $ADP PT Raised to $147.00 at Morgan Stanley http://www.thestockobserver.com/?p=2917037
1255983976218423297,https://twitter.com/JohnAByrne/status/1255983976218423297,JohnAByrne,,2020-04-30 22:14:49+00:00,0,2,@jpmorgan @BoothFullTime @MorganStanley,,,"Joshua Lah left @jpmorgan in London to get his MBA at @BoothFullTime and gives credit to his mentor, Kaj Christenson, who instilled in him the confidence to pursue an MBA. The Kuala Lumpur native joins @MorganStanley in NYC after his graduation in June https://bit.ly/3bUuKMv"
1255983860744990720,https://twitter.com/PoetsAndQuants/status/1255983860744990720,PoetsAndQuants,,2020-04-30 22:14:22+00:00,0,2,@jpmorgan @BoothFullTime @MorganStanley,,,"Joshua Lah left @jpmorgan in London to get his MBA at @BoothFullTime and gives credit to his mentor, Kaj Christenson, who instilled in him the confidence to pursue an MBA. The Kuala Lumpur native joins @MorganStanley in NYC after his graduation in June https://bit.ly/3bUuKMv"
1255983659577946112,https://twitter.com/GoldmanSachBOT/status/1255983659577946112,GoldmanSachBOT,,2020-04-30 22:13:34+00:00,0,0,,,,"Public Service Enterprise Group (PEG) surprised the market with Q4 result. Morgan Stanley changed the rating to Buy, as Public Service Enterprise Group (PEG) has great fundamentals and its currently trading at a PE of 0.97 with a PEG of 0.48."
1255982857702473729,https://twitter.com/astraffon/status/1255982857702473729,astraffon,,2020-04-30 22:10:22+00:00,0,7,,,,I'm not an equity analyst (high yield debt has been my thing) but did anyone see online pet food retailer $CHWY being used as a comp in Morgan Stanley's 'bull' case for $DKNG? It get it is a 'bull' case... but still.
1255981104168931328,https://twitter.com/GoldmanSachBOT/status/1255981104168931328,GoldmanSachBOT,,2020-04-30 22:03:24+00:00,0,0,,,,"Molson Coors Brewing Co. (TAP) surprised the market with Q1 result. Morgan Stanley changed the rating to Hold, as Molson Coors Brewing Co. (TAP) reflects limited EPS from core operations."
1255980501573173251,https://twitter.com/ShowKnows/status/1255980501573173251,ShowKnows,,2020-04-30 22:01:01+00:00,0,1,@Benzinga,,,Morgan Stanley Wants To Bet On DraftKing's Stock $DKNG via @benzinga
1255980416961376256,https://twitter.com/JoeCopeland_MS/status/1255980416961376256,JoeCopeland_MS,,2020-04-30 22:00:41+00:00,0,0,,,,"Rachel Wilson has always done high-impact work. This former NSA agent uses her experience in cybersecurity to help protect Morgan Stanley clients. She shares her story and advice: be confident, take risks. "
1255979004328206336,https://twitter.com/FINANCIALPORTAL/status/1255979004328206336,FINANCIALPORTAL,,2020-04-30 21:55:04+00:00,0,0,,,,Buzzingstocks Motherson Sumi shares jump 9% after Morgan Stanley maintains overweight call 
1255978998821093377,https://twitter.com/FINANCIALPORTAL/status/1255978998821093377,FINANCIALPORTAL,,2020-04-30 21:55:02+00:00,0,0,,,,Buzzingstocks Hexaware Technologies share price falls 3% post result; Morgan Stanley raises target 
1255978747368484865,https://twitter.com/EddieKull/status/1255978747368484865,EddieKull,,2020-04-30 21:54:02+00:00,0,4,@MandellCrawley @MorganStanley @FordhamNYC @Maroon_Club,,,“We want to thank @MandellCrawley @MorganStanley for taking the time to speak with our team today about life skills and leadership qualities. Also thank you to Rose McSween for helping set up! “ @FordhamNYC Dr. Rose McSween Mandell Crawley @maroon_club https://lnkd.in/euAr7HA
1255978105346367488,https://twitter.com/zurich_london/status/1255978105346367488,zurich_london,MorganStanley,2020-04-30 21:51:29+00:00,0,0,,#ClapForOurCarers #coronavirus #COVID #Equality #StayHomeStaySafe #StayAtHome #StayAtHome,,Well done Morgan Stanley and Ascend Leader for this. Keep pushing for all of us #ClapForOurCarers #coronavirus #COVIDー19 #Equality #StayHomeStaySafe #StayAtHome
1255976472537251840,https://twitter.com/CPastoloveMS/status/1255976472537251840,CPastoloveMS,,2020-04-30 21:45:00+00:00,0,0,,,,"“What is that next Neil Armstrong moment? That one small step for man moment? There could be multiple ones.” Global Head of Auto and Shared Mobility, Adam Jonas explains the new space economy in a Morgan Stanley Minute. "
1255976334452494342,https://twitter.com/neilcybart/status/1255976334452494342,neilcybart,,2020-04-30 21:44:27+00:00,2,17,,,,"Morgan Stanley: Why did you increase the buyback program by only $50 billion? Apple: When you consider the remaining amount of repurchase authorization we have from last year, we now have $90 billion of buyback authorization. That's plenty for us over the next 12 months."
1255976212029202439,https://twitter.com/CNBC/status/1255976212029202439,CNBC,,2020-04-30 21:43:58+00:00,2,6,@CNBCPro,,,"For subscribers: Morgan Stanley goes ""all in on best-in-breed sports betting"" stock https://cnb.cx/3d2KvBn Check out @CNBCPro for a free trial."
1255975239856594944,https://twitter.com/traderjon01/status/1255975239856594944,traderjon01,petedoom,2020-04-30 21:40:06+00:00,0,0,,,,$TRPX .43 Pere is giving you tomorrow's runner the night before! Morgan Stanley bought 11 million shares. 
1255975225663139840,https://twitter.com/sixcolorsevent/status/1255975225663139840,sixcolorsevent,,2020-04-30 21:40:03+00:00,0,2,,,,"Katie Huberty, Morgan Stanley: Longer term question. Structural changes that might present opportunities for new revenue streams—past comments on health and AR?"
1255974527990890498,https://twitter.com/CengizD69124736/status/1255974527990890498,CengizD69124736,,2020-04-30 21:37:17+00:00,7,18,,,,"Morgan Stanley parayı yönetecek, Rockefeller Center iş adamlarını bir kulvara sokacak, IMF ABD dışındaki ülkeleri Washington'a bağımlı hale getirecek CIA da dünyanın her noktasında istihbarat faaliyetinde bulunacaktı1913 yılında Amerikan Merkez Bankası kuruldu FED"
1255974522068574208,https://twitter.com/CengizD69124736/status/1255974522068574208,CengizD69124736,,2020-04-30 21:37:15+00:00,12,28,,,,"Yıl 1933. ABD Başkanı Roosevelt de altının değerini yükselttiğini açıkladı. O yıllarda ABD Başkanı tüm emtia fiyatlarının değerini belirliyordu. 1935'te Morgan Stanley kuruldu. 1939'da Rockefeller Center, 1944'te IMF ve 1947'de CIA kuruldu."
1255972704399716352,https://twitter.com/RickKrollman_MS/status/1255972704399716352,RickKrollman_MS,,2020-04-30 21:30:02+00:00,0,0,,#NFL #NBA #NBA,,Launching a career in the #NFL or #NBA can be a rewarding yet daunting process. That's why there's the Morgan Stanley pre- and post-draft loan program for prospective NBA/NFL players. Reach out for more information. 
1255972696506105856,https://twitter.com/wealth_mgmt/status/1255972696506105856,wealth_mgmt,,2020-04-30 21:30:00+00:00,0,0,,,,"Morgan Stanley lost 276 from the year prior, Wells Fargo ended the quarter down 3% year over year and UBS lost 53 advisors. "
1255972129998286849,https://twitter.com/petedoom/status/1255972129998286849,petedoom,,2020-04-30 21:27:45+00:00,1,3,,,,Morgan stanley 13g filed today owns 11 million shares $trpx
1255971657266667523,https://twitter.com/braschen1/status/1255971657266667523,braschen1,KathyPenton,2020-04-30 21:25:52+00:00,0,1,,,,He and his team did it to Morgan Stanley a few innocent people went to jail
1255971628497985538,https://twitter.com/mikethebike17/status/1255971628497985538,mikethebike17,enn_nafnlaus,2020-04-30 21:25:45+00:00,0,0,,,,Investment bank Morgan Stanley have said that they forecast no recycling of lithium at all over the decade ahead. What are we going to do with all those waste? Put them at the bottom of the sea?
1255970666689564672,https://twitter.com/mikethebike17/status/1255970666689564672,mikethebike17,_42________,2020-04-30 21:21:56+00:00,0,0,,,,Investment bank Morgan Stanley have said that they forecast no recycling of lithium at all over the decade ahead. What are we going to do with all those waste? Put them at the bottom of the sea?
1255968921791823874,https://twitter.com/MaranoGroupMS/status/1255968921791823874,MaranoGroupMS,,2020-04-30 21:15:00+00:00,0,0,,,,"“I have seen, over the years, women finding their power, finding their voice, and being happier,” says Morgan Stanley Private Wealth Advisor Kimberley Hatchett. Learn how she’s empowering women when it comes to money and family finances. "
1255966853077389314,https://twitter.com/daviddo43706820/status/1255966853077389314,daviddo43706820,MorganStanley,2020-04-30 21:06:47+00:00,0,1,,,,What about the so called unique CRAPPY ways brokers like the NICHOLAS GROUP INFECT Investors CAPITAL by flushing it down the SEWER!
1255966010743676931,https://twitter.com/GoldmanSachBOT/status/1255966010743676931,GoldmanSachBOT,,2020-04-30 21:03:26+00:00,0,0,,,,"Microsoft Corp. (MSFT) surprised the market with Q1 result. Morgan Stanley changed the rating to Underperform, as Microsoft Corp. (MSFT) is trading at over 80 times its book value with a trailing PE of over 40."
1255965826617917441,https://twitter.com/autumnsdad1/status/1255965826617917441,autumnsdad1,,2020-04-30 21:02:42+00:00,0,2,,,,"$TRPX SCHEDULE 13G Morgan Stanley owns 11,586,440 shares or 5.1% stake !!! VERY NICE !!!! $TRPX"
1255964079316856832,https://twitter.com/mysteryladey/status/1255964079316856832,mysteryladey,foe_us,2020-04-30 20:55:45+00:00,0,0,,,,horay for friends
1255961617428369408,https://twitter.com/Graalfinancial/status/1255961617428369408,Graalfinancial,,2020-04-30 20:45:58+00:00,0,0,@CMEGroup @CMEActiveTrader @AkunaCapital @MorganStanley @Barclays @BMO @BNPParibas @Citibank @CreditSuisse @FlowTraders @GoldmanSachs @jpmorgan @SocieteGenerale,,,"I don't have a PhD, but I can read and algorithmically model the how LMMs move the price according to the order flow. @CMEGroup @CMEActiveTrader @AkunaCapital @MorganStanley @Barclays @BMO @BNPParibas @Citibank @CreditSuisse @FlowTraders @GoldmanSachs @jpmorgan @SocieteGenerale"
1255960611462275073,https://twitter.com/TargetPrices/status/1255960611462275073,TargetPrices,,2020-04-30 20:41:59+00:00,0,0,,,,$ADP Target Raised by Stifel Nicolaus Hold USD 150 » USD 155 Target Raised by Morgan Stanley Equal Weight USD 140 » USD 147 Target Lowered by BMO Capital Markets Market Perform USD 179 » USD 154 
1255960244557053957,https://twitter.com/TheDinarian/status/1255960244557053957,TheDinarian,,2020-04-30 20:40:31+00:00,0,1,,,,"Federal Reserve Board announces the public comment period has been extended through June 4, 2020, for the notice by Morgan Stanley of New York, New York, to acquire E*TRADE Financial Corporation of Arlington, Virginia "
1255958865394446336,https://twitter.com/WallStreetOasis/status/1255958865394446336,WallStreetOasis,,2020-04-30 20:35:02+00:00,0,0,,,,Morgan Stanley Interview | 1st Year Analyst | Debt Capital Markets Q: What’s the difference between DCM and Leveraged Finance? A: They’re similar but Leveraged Finance is more “modeling-intensive” and does more of the deal execution with industry &amp;... 
1255958862940823554,https://twitter.com/JPJP215/status/1255958862940823554,JPJP215,,2020-04-30 20:35:02+00:00,0,0,,,,This is a new area for me. Morgan Stanley goes 'all in on best-in-breed sports betting' stock 
1255958781026017282,https://twitter.com/somospueblo_es/status/1255958781026017282,somospueblo_es,,2020-04-30 20:34:42+00:00,2,3,,,,"Se abre la veda a buitres para comprar deuda: JPMorgan, Santander ,Bank of America , BNP Paribas, Credit Suisse, Deutsche Bank, Goldman Sachs y Morgan Stanley serán de nuevo los que se benefician de la crisis, mientras los trabajadores somos más pobres. "
1255957632646631425,https://twitter.com/foe_us/status/1255957632646631425,foe_us,,2020-04-30 20:30:08+00:00,10,20,@MorganStanley,,,HUGE WIN! @MorganStanley just became the fifth major bank to pledge not to fund drilling in the Arctic! This shift is thanks to the tireless efforts of Indigenous and climate activists. We must protect our wild places from being handed over to Big Oil. 
1255957597716447235,https://twitter.com/fintel_io/status/1255957597716447235,fintel_io,,2020-04-30 20:30:00+00:00,0,0,,,,"Morgan Stanley has filed a new 13G, reporting 5.1% ownership in $TRPX -"
1255957356996853775,https://twitter.com/JoseF38155544/status/1255957356996853775,JoseF38155544,FranNunesDPr,2020-04-30 20:29:03+00:00,0,1,,,,"Según morgan stanley , puede caer un 22% ...casi a niveles de corralito bancario."
1255957290995322880,https://twitter.com/MrKennethPowers/status/1255957290995322880,MrKennethPowers,MrKennethPowers,2020-04-30 20:28:47+00:00,0,2,,,,TRPX - Form SC 13G Therapix Biosciences Filed by: MORGAN STANLEY $TRPX
1255957244979666946,https://twitter.com/SheWolfofWS/status/1255957244979666946,SheWolfofWS,,2020-04-30 20:28:36+00:00,0,1,,,,$TRPX Schedule 13G Morgan Stanley https://www.sec.gov/Archives/edgar/data/895421/000089542120000317/TherapixBiosciences.txt
1255957105179148289,https://twitter.com/carriekirby/status/1255957105179148289,carriekirby,,2020-04-30 20:28:03+00:00,0,0,@MorganStanley,,,Thanks to @morganstanley's smart online commentary for helping inspire this piece on what to do with money in the time of COVID 
1255956249629396993,https://twitter.com/TargetPrices/status/1255956249629396993,TargetPrices,,2020-04-30 20:24:39+00:00,0,0,,,,$EBAY Maintains UBS Neutral USD 38 » USD 41 Maintains Morgan Stanley Equal-Weight USD 35 » USD 38 Maintains Credit Suisse Outperform USD 48 » USD 50 2020-04-30 Reiterated by Wedbush Outperform USD 44 
1255956146172702724,https://twitter.com/AdryelisL/status/1255956146172702724,AdryelisL,,2020-04-30 20:24:14+00:00,0,0,@reedhastings @MorganStanley,,,@reedhastings @MorganStanley renew season 2 for everything sucks please and thank you
1255956107677270026,https://twitter.com/Rich_HeRich/status/1255956107677270026,Rich_HeRich,,2020-04-30 20:24:05+00:00,0,1,,,,$TRPX SCHEDULE 13G Morgan Stanley https://www.twitter.com/rich_herich Wolf of Royal Palm Beach 
1255956107362697224,https://twitter.com/JonahLupton/status/1255956107362697224,JonahLupton,AlwaysBeHustlin,2020-04-30 20:24:05+00:00,0,1,,,,He’s very entertaining.
1255955174046269440,https://twitter.com/picks_horse/status/1255955174046269440,picks_horse,,2020-04-30 20:20:22+00:00,0,1,,,,$TRPX Morgan Stanley 13G
1255955133692772353,https://twitter.com/InsiderForms/status/1255955133692772353,InsiderForms,,2020-04-30 20:20:13+00:00,3,2,,,,$TRPX Morgan Stanley has filed Form SC 13G with SEC. Reporting 5.1% Ownership. 
1255955095965089793,https://twitter.com/Ultra_Calls/status/1255955095965089793,Ultra_Calls,,2020-04-30 20:20:04+00:00,1,4,,,,$TRPX Morgan Stanley 13G
1255955023449686018,https://twitter.com/ACInvestorBlog/status/1255955023449686018,ACInvestorBlog,,2020-04-30 20:19:46+00:00,7,22,,,,"$TRPX SCHEDULE 13G Morgan Stanley owns 11,586,440 shares or 5.1% stake !!! VERY NICE !!!!"
1255954895892623362,https://twitter.com/King_Biotech/status/1255954895892623362,King_Biotech,,2020-04-30 20:19:16+00:00,1,0,,,,"$TRPX Fresh 13G Morgan Stanley owns 11,586,440 shares http://archive.fast-edgar.com//20200430/A6LZA222Z22UC2D2222D2WZ2FQ6OZZ22A822/"
1255954168713490434,https://twitter.com/hammertime2019/status/1255954168713490434,hammertime2019,,2020-04-30 20:16:22+00:00,0,0,,,,04:14PM TRPX - Form SC 13G Therapix Biosciences Filed by: MORGAN STANLEY
1255954085527932929,https://twitter.com/JTasioulas/status/1255954085527932929,JTasioulas,,2020-04-30 20:16:03+00:00,3,3,,,,"“Morgan Stanley’s Jacob Nell estimates that GDP will this year contract by 8.4pc in Germany, 10.7pc in France, 12-13pc for Greece, Spain, and Portugal, 15pc for Italy, even under its base scenario, worse than any year in recorded peace-time history.” "
1255953376354893826,https://twitter.com/TargetPrices/status/1255953376354893826,TargetPrices,,2020-04-30 20:13:14+00:00,0,0,,,,$HOLX Maintains SVB Leerink Outperform USD 41 » USD 62 Target Raised by Needham &amp; Company LLC Buy USD 52 » USD 60 Target Raised by Wells Fargo Overweight USD 48 » USD 60 Target Raised by Morgan Stanley Equal Weight USD 40 » USD 53 https://www.stocktargetadvisor.com/stock/USA/NYE/HOLX#analyst-rating-tab
1255953049115176963,https://twitter.com/dlonorse/status/1255953049115176963,dlonorse,LizAnnSonders,2020-04-30 20:11:56+00:00,0,0,,,,Wow!
1255952607488749573,https://twitter.com/CyberGrants/status/1255952607488749573,CyberGrants,,2020-04-30 20:10:10+00:00,1,2,,,,Morgan Stanley Increases COVID-19 Charitable Commitment to $25 Million 
1255951990481453060,https://twitter.com/FinanzDK/status/1255951990481453060,FinanzDK,,2020-04-30 20:07:43+00:00,0,0,,,,"Federal Reserve Board announces the public comment period has been extended through June 4, 2020, for the notice by Morgan Stanley of New York, New York, to acquire E*TRADE Financial Corporation of Arlington, Virginia - https://finanz.dk/federal-reserve-board-announces-the-public-comment-period-has-been-extended-through-june-4-2020-for-the-notice-by-morgan-stanley-of-new-york-new-york-to-acquire-etrade-financial-corporation-of-ar/"
1255951802828234753,https://twitter.com/MarkoMartinoli/status/1255951802828234753,MarkoMartinoli,Radosav77,2020-04-30 20:06:58+00:00,0,1,,,,Što EU? Goldman i Morgan Stanley su bili u pred-bankrotu.
1255949770226462720,https://twitter.com/deus_trader/status/1255949770226462720,deus_trader,,2020-04-30 19:58:54+00:00,0,0,,,,Optimus Maximus v2 2020-04-30 15:58 EST. *Closed/Covered previously shorted: $MS at $39.65 for 1.97 loss (-5.23%). Morgan Stanley (CORP). Trade Id: 40054833003024752. Stats: https://deustrader.com/optimus_maximus2.html
1255948966426038272,https://twitter.com/BWiT_ALL/status/1255948966426038272,BWiT_ALL,,2020-04-30 19:55:42+00:00,0,0,,,,"Here’s why companies won’t move their supply chains out of China, says Morgan Stanley "
1255946914379358208,https://twitter.com/CSRwire/status/1255946914379358208,CSRwire,,2020-04-30 19:47:33+00:00,0,0,,,,Morgan Stanley Increases COVID-19 Charitable Commitment to $25 Million 
1255946716831940608,https://twitter.com/innercitypress/status/1255946716831940608,innercitypress,,2020-04-30 19:46:46+00:00,0,4,,,,DC SWAMP: Rogue Regulator Joseph Otting Closed Comment Period on His Attack on Community Reinvestment Act - Now Federal Reserve Extends Comments on Morgan Stanley Application to Buy E*Trade to June 4. What is wrong with Otting? http://www.innercitypress.com/cra10coronavirusffwicp043020.html
1255946647940616192,https://twitter.com/FintechBot/status/1255946647940616192,FintechBot,,2020-04-30 19:46:29+00:00,0,0,@Finextra,,,Fed extends public comment period for Morgan Stanley acquisition of E*Trade https://www.finextra.com/pressarticle/82358/fed-extends-public-comment-period-for-morgan-stanley-acquisition-of-etrade?utm_medium=rssfinextra&amp;utm_source=finextrafeed by @Finextra
1255946547143024644,https://twitter.com/Finextra/status/1255946547143024644,Finextra,,2020-04-30 19:46:05+00:00,3,8,,#fintech,,Company announcement: Fed extends public comment period for Morgan Stanley... https://www.finextra.com/pressarticle/82358/fed-extends-public-comment-period-for-morgan-stanley-acquisition-of-etrade #fintech
1255945824925659136,https://twitter.com/liaopinion/status/1255945824925659136,liaopinion,,2020-04-30 19:43:13+00:00,0,0,,,,"Here’s why companies won’t move their supply chains out of China, says Morgan Stanley "
1255945402991308802,https://twitter.com/ExchangeNews/status/1255945402991308802,ExchangeNews,,2020-04-30 19:41:33+00:00,0,0,,,,"Federal Reserve Board Announces The Public Comment Period Has Been Extended Through June 4, 2020, For The Notice By Morgan Stanley Of New York, New York, To Acquire E*TRADE Financial Corporation of Arlington, Virginia http://dlvr.it/RVmxyX"
1255945197231448066,https://twitter.com/high_forex/status/1255945197231448066,high_forex,,2020-04-30 19:40:44+00:00,0,0,,,,Federal Reserve extends comment period for Morgan Stanley’s pending E*Trade acquisition 
