Id,permalink,username,to,date,retweets,favorites,mentions,hashtags,geo,text
1255542113137238022,https://twitter.com/talllguy/status/1255542113137238022,talllguy,,2020-04-29 16:59:01+00:00,0,3,@HarborPointMD,,,I updated OpenStreetMap based on my exploration of the new Baltimore Waterfront Promenade section at @HarborPointMD You can now get beyond the Morgan Stanley building to Willis Street. Check out the park I tweeted about yesterday. https://osm.org/go/ZZfRe61lw
1255541998657900545,https://twitter.com/hackerrank/status/1255541998657900545,hackerrank,,2020-04-29 16:58:33+00:00,1,14,@GoldmanSachs @PayPal @MorganStanley @rvivek @crunchbase,,,"Even as companies lay off workers, financial services firms continue to hire! Data from HackerRank shows interviews at financial services firms are up 39% since Jan among clients like @GoldmanSachs @PayPal &amp; @MorganStanley shares @rvivek with @crunchbase"
1255541698668777473,https://twitter.com/goldenethereum/status/1255541698668777473,goldenethereum,,2020-04-29 16:57:22+00:00,0,0,,,,E-Trade: Recent Earnings Further Support The Wisdom Of Morgan Stanley's Acquisition https://seekingalpha.com/article/4341014-e-trade-recent-earnings-support-wisdom-of-morgan-stanleys-acquisition
1255541400046759936,https://twitter.com/ClarkWDerry/status/1255541400046759936,ClarkWDerry,,2020-04-29 16:56:11+00:00,4,5,,,,Oil demand won't recover to 2019 levels until end of 2021: Morgan Stanley 
1255541364059750407,https://twitter.com/kazzawilker/status/1255541364059750407,kazzawilker,,2020-04-29 16:56:02+00:00,0,0,,,,"New post: ""Morgan Stanley cree que el sector de las 'telecos' va a mejorar su reputación por su labor en la crisis del coronavirus"" "
1255540912807010304,https://twitter.com/SeekingAlpha/status/1255540912807010304,SeekingAlpha,,2020-04-29 16:54:15+00:00,1,1,,#economy #stocks #business,,$ETFC - E-Trade: Recent Earnings Further Support The Wisdom Of Morgan Stanley's Acquisition. https://seekingalpha.com/article/4341014-e-trade-recent-earnings-support-wisdom-of-morgan-stanleys-acquisition?source=feed_f&amp;utm_campaign=twitter_automated&amp;utm_content=article&amp;utm_medium=social&amp;utm_source=twitter_automated #economy #stocks #business
1255540551069253634,https://twitter.com/StocksDiscovery/status/1255540551069253634,StocksDiscovery,,2020-04-29 16:52:48+00:00,2,2,@MorganStanley,#stocks #investing #StockMarket #StockTrading #investing,,Which #stocks will be best performers when the economic recovery begins? @MorganStanley #investing #StockMarket #StockTrading #investing
1255537734573309959,https://twitter.com/OilandEnergy/status/1255537734573309959,OilandEnergy,,2020-04-29 16:41:37+00:00,14,30,,,,"Oil demand around the world will not return to the pre-virus levels of 2019 until the fourth quarter of 2021, as countries will be slowly emerging from the lockdowns and the economic recession, according to Morgan Stanley "
1255537624556634116,https://twitter.com/infoguy411/status/1255537624556634116,infoguy411,infoguy411,2020-04-29 16:41:11+00:00,1,1,@kevinolearytv @BankofAmerica @jpmorgan @Fidelity @etrade @MorganStanley @blackrock @MerrillLynch @RaymondJames @StockWatchHQ @blackstone @ticktockstocks @Citi,#ALERT #Medrecycler,,@kevinolearytv @BankofAmerica @jpmorgan @Fidelity @etrade @MorganStanley @blackrock @MerrillLynch @RaymondJames @StockWatchHQ @blackstone @ticktockstocks @citi $SNPW #ALERT&gt;.0013^8% #Medrecycler celebrates Earth Day!We look forward to opening our Plant https://www.facebook.com/Medrecycler-1935426800092518/
1255537401885155329,https://twitter.com/ELIZABETHCAMPMS/status/1255537401885155329,ELIZABETHCAMPMS,,2020-04-29 16:40:18+00:00,0,0,,#quarantine #Investing #MorganStanley,,"As some states begin to loosen #quarantine restrictions, ""stay at home stocks"" may no longer be the place to be. Chief Investment Officer Mike Wilson explains why. #Investing #MorganStanley "
1255536526743662593,https://twitter.com/IndiaER/status/1255536526743662593,IndiaER,,2020-04-29 16:36:49+00:00,0,1,,#coattailing #cloning #topinvestors #BSE #NSE #equity #Shareholding,,Portfolio updates for major investors 29 April DSP FUND Increased VARDHMAN TEXTILES Nalanda Fund Entered THERMAX Morgan Stanley Entered Tata Motors DVR #coattailing #cloning #topinvestors #BSE #NSE #equity #Shareholding
1255535628302901248,https://twitter.com/InsurgentePress/status/1255535628302901248,InsurgentePress,,2020-04-29 16:33:15+00:00,2,0,@MorganStanley,,,Un análisis realizado por @MorganStanley revela que la demanda de crudo no se recuperará sino hasta fines del 2021. https://insurgentepress.com.mx/demanda-de-crudo-no-se-recuperara-hasta-fines-del-2021-morgan-stanley/
1255535547105382401,https://twitter.com/Chrisgebb/status/1255535547105382401,Chrisgebb,,2020-04-29 16:32:55+00:00,0,0,@POTUS @MorganStanley,,,@POTUS This is just another news headline @MorganStanley and I created to keep people entertained. You want to fill me in on what is going On? 
1255535452561473537,https://twitter.com/GoldmanSachBOT/status/1255535452561473537,GoldmanSachBOT,,2020-04-29 16:32:33+00:00,0,0,,,,"JinkoSolar Holding Company Limi (JKS) surprised the market with Q2 result. Morgan Stanley changed the rating to Sell, as JinkoSolar Holding Company Limi (JKS) tumbled about 16% since the SEC hearing."
1255535208511799296,https://twitter.com/FlaShBloGLive/status/1255535208511799296,FlaShBloGLive,,2020-04-29 16:31:35+00:00,0,0,,,,"Rotation Into Small Caps 'Has Legs,' Says Shalett of Morgan Stanley "
1255535200223866881,https://twitter.com/rooms_data/status/1255535200223866881,rooms_data,,2020-04-29 16:31:33+00:00,0,0,,,,"Rotation Into Small Caps 'Has Legs,' Says Shalett of Morgan Stanley http://dlvr.it/RVhjmZ"
1255535199993159680,https://twitter.com/OstoulSB/status/1255535199993159680,OstoulSB,,2020-04-29 16:31:33+00:00,0,0,,,,"Rotation Into Small Caps 'Has Legs,' Says Shalett of Morgan Stanley http://dlvr.it/RVhjnw"
1255535199791845380,https://twitter.com/ronmc1/status/1255535199791845380,ronmc1,,2020-04-29 16:31:33+00:00,0,0,,,,"Rotation Into Small Caps 'Has Legs,' Says Shalett of Morgan Stanley http://dlvr.it/RVhjnL"
1255535084284915712,https://twitter.com/staibenecosi79/status/1255535084284915712,staibenecosi79,,2020-04-29 16:31:05+00:00,0,0,,,,Morgan Stanley: Oil Demand Won’t Return To ‘Normal’ Until End-2021 https://ift.tt/2yPaL3j
1255535069252501504,https://twitter.com/rayrothfe/status/1255535069252501504,rayrothfe,,2020-04-29 16:31:01+00:00,0,0,,,,"“Today's report presages what we expect will be a significant 38% decline in GDP in 2Q."" —Ellen Zentner, Morgan Stanley "
1255534602799779845,https://twitter.com/blackarcintel/status/1255534602799779845,blackarcintel,,2020-04-29 16:29:10+00:00,0,0,,,,"New post: ""Morgan Stanley: Oil Demand Won’t Return To ‘Normal’ Until End-2021"" https://ift.tt/2yPaL3j"
1255534443026145281,https://twitter.com/yubartina/status/1255534443026145281,yubartina,,2020-04-29 16:28:32+00:00,0,1,@bolsamania,,,Morgan Stanley creu que 'telecos' com Telefónica sortiran guanyant gràcies a la Covid http://tinyurl.com/y777dseh vía @Bolsamania
1255534319734489094,https://twitter.com/yubartina/status/1255534319734489094,yubartina,,2020-04-29 16:28:03+00:00,0,0,@bolsamania,,,Morgan Stanley cree que telecos como Telefónica saldrán ganando gracias al Covid http://tinyurl.com/ycs682en vía @Bolsamania
1255533235947405317,https://twitter.com/GoldmanSachBOT/status/1255533235947405317,GoldmanSachBOT,,2020-04-29 16:23:44+00:00,0,0,,,,"Morgan Stanley (MS) surprised the market with Q4 result. Goldman Sachs changed the rating to Sell, as Morgan Stanley (MS) tumbled about 16% since the SEC hearing."
1255533193652064256,https://twitter.com/OG_Advisors/status/1255533193652064256,OG_Advisors,,2020-04-29 16:23:34+00:00,0,0,,,,Morgan Stanley: Oil Demand Won’t Return To ‘Normal’ Until End-2021 
1255532897634844674,https://twitter.com/Stockomendation/status/1255532897634844674,Stockomendation,,2020-04-29 16:22:24+00:00,1,2,,#RPS #WMH #WG #DC #investing,,Mid-Week Update Best Performing Tips so far this Week - Hold #RPS by Peel Hunt +40.46 % Buy #WMH by Citi +26.13 % Overweight #WG. by Morgan Stanley +25.71 % Buy BARC by The Motley Fool +19.79 % Buy #DC. by Liberum Capital +18.18 % http://stockomendation.com #investing
1255532872179556354,https://twitter.com/MichaelMendieta/status/1255532872179556354,MichaelMendieta,,2020-04-29 16:22:18+00:00,0,0,@MorganStanley,,,@MorganStanley ???
1255532808321355782,https://twitter.com/hmaelMuld/status/1255532808321355782,hmaelMuld,,2020-04-29 16:22:02+00:00,0,0,,,,Morgan Stanley советует запасаться рублями
1255532068408344578,https://twitter.com/carbonreports/status/1255532068408344578,carbonreports,,2020-04-29 16:19:06+00:00,0,1,,#Morgan #crudeoil #CL_F #WTI #Brent,,#Morgan Stanley: Oil Demand Won’t Return To ‘Normal’ Until End-2021 #crudeoil #CL_F #WTI #Brent
1255531612877590529,https://twitter.com/stocknewstimes/status/1255531612877590529,stocknewstimes,,2020-04-29 16:17:17+00:00,0,0,,,,Zebra Technologies $ZBRA Price Target Increased to $217.00 by Analysts at Morgan Stanley http://www.thestockobserver.com/?p=2911499
1255531591327191040,https://twitter.com/stocknewstimes/status/1255531591327191040,stocknewstimes,,2020-04-29 16:17:12+00:00,0,0,,,,Werner Enterprises $WERN Price Target Increased to $44.00 by Analysts at Morgan Stanley http://www.thestockobserver.com/?p=2911511
1255530994184212482,https://twitter.com/Tyler929394/status/1255530994184212482,Tyler929394,,2020-04-29 16:14:50+00:00,0,3,@jimcramer @CNBCTheExchange @rbccm @UBS @MorganStanley @GuggenheimPtnrs @markets @CNNBusiness @CNBCFastMoney @WarrenBuffett @FoxBusiness @CNN,,,GDP numbers like its a great depression. Home Sales TANKED. 30 MIL Unemployed. Nasdaq about FLAT Year to Date POP THE BUBBLE !! @jimcramer @CNBCTheExchange @rbccm @UBS @MorganStanley @GuggenheimPtnrs @markets @CNNBusiness @CNBCFastMoney @WarrenBuffett @FoxBusiness @CNN
1255530280997142528,https://twitter.com/bsindia/status/1255530280997142528,bsindia,,2020-04-29 16:12:00+00:00,2,7,@humsitweets,#banking,,"Ridham Desai, MD, Morgan Stanley said turning neutral on #banking stocks is the next big move. Such moves are an indication of how big money is behaving. @humsitweets reports"
1255530200215040000,https://twitter.com/reuters_russia/status/1255530200215040000,reuters_russia,,2020-04-29 16:11:41+00:00,7,15,,,,Спрос на нефть не восстановится до уровня 19г до конца 21г -- Morgan Stanley 
1255528775690960896,https://twitter.com/andrewwcox/status/1255528775690960896,andrewwcox,,2020-04-29 16:06:01+00:00,0,1,,#MorganStanley #CrudeOil,,#MorganStanley: #CrudeOil Demand Won’t Return To ‘Normal’ Until End-2021 https://oilprice.com/Energy/Crude-Oil/Morgan-Stanley-Oil-Demand-Wont-Return-To-Normal-Until-End-2021.html
1255528496383832066,https://twitter.com/BostonStratInt/status/1255528496383832066,BostonStratInt,,2020-04-29 16:04:54+00:00,0,0,,,,Morgan Stanley: Oil Demand Won’t Return To ‘Normal’ Until End-2021 https://buff.ly/2xmCmZm
1255527781959639041,https://twitter.com/lauratomcoMS/status/1255527781959639041,lauratomcoMS,,2020-04-29 16:02:04+00:00,0,0,,#financialliteracy #GirlScouts,,"It’s never too early for young women to get the hang of investing and putting money toward their short, medium and long-term goals. Find out more investing tips from Morgan Stanley Financial Advisor Thien Lee. #financialliteracy #GirlScouts"
1255526130708287490,https://twitter.com/retailjwlrindia/status/1255526130708287490,retailjwlrindia,,2020-04-29 15:55:30+00:00,0,0,@GJCIndia,#AndrewSheets #BankofAmerica #centralbanks #CHINABUYER #clamourforinsurance #coronaviruscrisis #exchangetradedfunds #Goldmarkets #goldprice #IndiaBullionandJewellers #MorganStanley #NAnanthaPadmanaban #PeterGrosskopf #SurendraMehta,,https://retailjewellerindia.com/rj-market-watch/decoded-how-gold-may-benefit-from-coronavirus-crisis/ @GJCindia #AndrewSheets #BankofAmerica #centralbanks #CHINABUYER #clamourforinsurance #coronaviruscrisis #exchangetradedfunds #Goldmarkets #goldprice #IndiaBullionandJewellers #MorganStanley #NAnanthaPadmanaban #PeterGrosskopf #SurendraMehta
1255525646920548353,https://twitter.com/stocknewstimes/status/1255525646920548353,stocknewstimes,,2020-04-29 15:53:35+00:00,0,0,,,,Sirius XM $SIRI Price Target Raised to $6.25 at Morgan Stanley http://www.thestockobserver.com/?p=2911361
1255524244890497025,https://twitter.com/NoticiasRueda/status/1255524244890497025,NoticiasRueda,,2020-04-29 15:48:01+00:00,0,0,,#todos #feedly,,Morgan Stanley cree que el sector de las telecomunicaciones van a mejorar su reputación por su labor en la crisis del Covid https://cincodias.elpais.com/cincodias/2020/04/29/companias/1588162621_359158.html#?ref=rss&amp;format=simple&amp;link=guid #todos #feedly
1255524101600526338,https://twitter.com/stocknewstimes/status/1255524101600526338,stocknewstimes,,2020-04-29 15:47:26+00:00,0,0,,,,Tenable $TENB Price Target Increased to $30.00 by Analysts at Morgan Stanley http://www.thestockobserver.com/?p=2911342
1255523651648135172,https://twitter.com/schooldaves/status/1255523651648135172,schooldaves,,2020-04-29 15:45:39+00:00,1,1,,,,"Trying to 'follow the muni' when it comes to Philly School District's bonds. Haven't figured out who're our actual creditors in 2019's $481m issuance. But I see BofA, Morgan Stanley, and Citi are the underwriters. Morgan was at the center of John Street's financial scandal."
1255522523271266311,https://twitter.com/StockJock22/status/1255522523271266311,StockJock22,,2020-04-29 15:41:10+00:00,0,0,,,,"$GOOGL Morgan Stanley Maintains Overweight On Alphabet, Raises Target To $1,400. Notes that Ad declines are likely to be somewhat less severe than expected and GOOGL is focused on efficiency/innovation to emerge stronger post downturn."
1255519847116615680,https://twitter.com/ljjones/status/1255519847116615680,ljjones,,2020-04-29 15:30:32+00:00,1,2,@alexavontobel @arcurn @evervault,,,"Shareworks by Morgan Stanley is proud to sponsor the Inc. Founders Project podcast. LISTEN: https://podcasts.apple.com/us/podcast/how-to-chase-your-passion-with-shane-curran-of-evervault/id1455941009?i=1000473009417 to this week's episode, as @alexavontobel speaks with Shane Curran @arcurn of @evervault. They talk about making data privacy simple and accessible for everyone."
1255519831048290304,https://twitter.com/ecejabe/status/1255519831048290304,ecejabe,,2020-04-29 15:30:28+00:00,0,0,,,,Morgan Stanley: las telecos van a mejorar su reputación por su labor en la crisis del Covid 
1255519468534579200,https://twitter.com/EduardoCathoud/status/1255519468534579200,EduardoCathoud,hbredda,2020-04-29 15:29:02+00:00,0,0,,,,"Morgan Stanley vai ficar esperando o dólar acima de R$6,00 em 2020. Titio Guedes sabe o que faz."
1255519168973230080,https://twitter.com/ayala_cesar/status/1255519168973230080,ayala_cesar,dataiFX,2020-04-29 15:27:50+00:00,0,0,,,," ROMA no se construyo en un día, es igual para el TRADING "
1255519051083919361,https://twitter.com/dataiFX/status/1255519051083919361,dataiFX,,2020-04-29 15:27:22+00:00,3,1,@MorganStanley,,,Demanda mundial de petróleo recuperaría niveles de 2019 a finales de 2021: Morgan Stanley https://www.dataifx.com/post/demanda-mundial-de-petroleo-recuperaria-niveles-de-2019-finales-de-2021-morgan-stanley @MorganStanley 
1255518418150789122,https://twitter.com/exis10tial/status/1255518418150789122,exis10tial,,2020-04-29 15:24:51+00:00,0,1,,,,"From Morgan Stanley $MS — Capex Plans Index dropped 11.2 points in April, lowest since July 2009. While survey details suggest current investment activity has bottomed, outlook for investment thereafter is likely to look more U-shaped compared to broader economy. $SPX $ES_F"
1255518313867853827,https://twitter.com/MollyCloudMS/status/1255518313867853827,MollyCloudMS,,2020-04-29 15:24:27+00:00,0,0,,#morganstanley #topwomenadvisors #shookresearch #forbes,,Honored to be included on this list! #morganstanley #topwomenadvisors #shookresearch #forbes
1255518045184954371,https://twitter.com/stocknewstimes/status/1255518045184954371,stocknewstimes,,2020-04-29 15:23:23+00:00,0,0,,,,Morgan Stanley Boosts Starbucks $SBUX Price Target to $76.00
1255517961596686337,https://twitter.com/hisseci41/status/1255517961596686337,hisseci41,,2020-04-29 15:23:03+00:00,1,32,,,,"Morgan Stanley : Petrol fiyatlarının 2021'de WTI 40 dolar/varil, Brent 45 dolar/varil'de dengelenmesi bekleniyor."
1255517393197109257,https://twitter.com/El_Plural/status/1255517393197109257,El_Plural,,2020-04-29 15:20:47+00:00,0,1,@MorganStanley,#ECONOM #COVID19,, #ECONOMÍA | Un informe elaborado por @MorganStanley recoge que la reputación de las empresas de telecomunicaciones se incrementará tras el #COVID19
1255517068067291136,https://twitter.com/infoguy411/status/1255517068067291136,infoguy411,infoguy411,2020-04-29 15:19:30+00:00,1,1,,#ALERT #HUGE #ACHIEVEMENTS #MILESTONES #ACCOMPLISHMENTS #Awarded,,"$SNPW #ALERT&gt;#HUGE #ACHIEVEMENTS,#MILESTONES &amp; #ACCOMPLISHMENTS for the CEO AND COMPANY.Don't know of any other Pinkys at this LEVEL of PROGRESS MOVING FORWARD .#Awarded 4 Valuable SOLAR PATENTS by USPTO (8K filings Nov/2019-Jan 2020) $100M IN Projects https://microcapdaily.com/sun-pacific-holding-corp-otcmkts-snpw-heats-up/125370/"
1255516398882881539,https://twitter.com/klydonMS/status/1255516398882881539,klydonMS,,2020-04-29 15:16:50+00:00,0,0,,#NFL #NBA #NBA,,Launching a career in the #NFL or #NBA can be a rewarding yet daunting process. That's why there's the Morgan Stanley pre- and post-draft loan program for prospective NBA/NFL players. Reach out for more information. 
1255516197229137920,https://twitter.com/AXMerc/status/1255516197229137920,AXMerc,,2020-04-29 15:16:02+00:00,0,0,@MorganStanley,,,@MorganStanley customer service told me stockplan connect users would get a banner to enroll in direct access accounts. I still haven't gotten one! How can I get this?
1255515984976281600,https://twitter.com/Jopadosichtus/status/1255515984976281600,Jopadosichtus,BloombergTV,2020-04-29 15:15:11+00:00,0,0,,,,"morgan stanley , citi a big manipulator"
1255515507744280585,https://twitter.com/BloombergTV/status/1255515507744280585,BloombergTV,,2020-04-29 15:13:18+00:00,2,3,@FerroTV,,,"The rotation from large to small caps has room to run, Morgan Stanley's Lisa Shalett tells @FerroTV https://www.bloomberg.com/news/articles/2020-04-28/asia-stocks-set-to-start-mixed-treasuries-climb-markets-wrap?srnd=premium"
1255514479980314627,https://twitter.com/kaideansthoo/status/1255514479980314627,kaideansthoo,binance,2020-04-29 15:09:13+00:00,0,1,@peterthiel @coinbase,#nobrainer,,"$RSR $RSV Investors: •@peterthiel, PayPal •@coinbase •Chris Blair, Morgan Stanley &amp; backed by multiple top investors of Silicon Valley. #nobrainer $btc $link $rsr $xrp $eth $data $dgb $ocean $vra $waves $ltc $eos $omg"
1255514137045741573,https://twitter.com/Zack67654417/status/1255514137045741573,Zack67654417,Hipster_Trader,2020-04-29 15:07:51+00:00,0,2,,,,I need Mike Wilson from Morgan Stanley to keep making new target increases everyday. Tom Lee as well
1255513561872216064,https://twitter.com/MallharRealtors/status/1255513561872216064,MallharRealtors,,2020-04-29 15:05:34+00:00,0,0,,#ChinaMinshengBank #ChinaCITICBank #MorganStanley #Cr #CreditSuisse #BancoBilbaoVizcayaArgentaria #Scotiabank #CommonwealthBank #Rabobank #AustraliaandNewZealandBankingGroup #Nordea #Westpac #StandardChartered #ChinaEverbrightBank #NationalAustraliaBank #DZBank,,#ChinaMinshengBank #ChinaCITICBank #MorganStanley #CréditMutuel #CreditSuisse #BancoBilbaoVizcayaArgentaria #Scotiabank #CommonwealthBank #Rabobank #AustraliaandNewZealandBankingGroup #Nordea #Westpac #StandardChartered #ChinaEverbrightBank #NationalAustraliaBank #DZBank
1255513441189670912,https://twitter.com/hacker5preme/status/1255513441189670912,hacker5preme,PennyStalker01,2020-04-29 15:05:05+00:00,0,0,,,,Bankruptcy
1255513402077786115,https://twitter.com/Thomas_Wilckens/status/1255513402077786115,Thomas_Wilckens,EBDgroup,2020-04-29 15:04:56+00:00,0,1,,,,"2/3 If you are concerned about this economy, you may want to read this ""MESSAGE IN A BOTTLE SOS: THE BLIND LEADING THE BLIND INTO THE TWILIGHT ZONE” David Janny SVP Morgan Stanley https://advisor.morganstanley.com/david.janny/documents/field/d/da/david-janny/DAVE%20JANNY%20APRIL%20THREE%202020%20INVESTMENT%20LETTER.pdf"
1255512713075347456,https://twitter.com/FinAd_IQ/status/1255512713075347456,FinAd_IQ,,2020-04-29 15:02:11+00:00,0,0,@UBS @RaymondJames,,,The latest industry moves: @UBS poaches 2 veteran Morgan Stanley execs to head markets in Rockies and CA; LPL loses $415M FA team to @RaymondJames; Elk River adds FA from BOK Financial; SEC names associate directors at Chicago regional office http://ow.ly/jNS150zqPxu
1255512266843316235,https://twitter.com/PacificDialog/status/1255512266843316235,PacificDialog,,2020-04-29 15:00:25+00:00,0,0,,#coronavirus,,"International networks can bring benefits and collaboration to the #coronavirus-torn world. Stephen Roach, former chairman of Morgan Stanley Asia, writes. http://www.bjreview.com/Opinion/202004/t20200429_800202522.html"
1255512161767403520,https://twitter.com/Maddy_Dychtwald/status/1255512161767403520,Maddy_Dychtwald,,2020-04-29 15:00:00+00:00,0,0,@MorganStanley,#isolation #coronavirus #community #medicine #healthcare,,"After the peak, what’s next with the coronavirus? #isolation #coronavirus #community #medicine #healthcare @MorganStanley "
1255510899194028035,https://twitter.com/Cambio16/status/1255510899194028035,Cambio16,,2020-04-29 14:54:59+00:00,0,0,@ReutersLatam,#Energia #COVID19,,#Energia | Morgan Stanley: La demanda mundial de petróleo tardará hasta el último trimestre de 2021 en recuperarse a sus niveles de 2019 a medida que los países emerjan lentamente de la crisis de la #COVID19. Vía @ReutersLatam
1255510713000513539,https://twitter.com/borismone/status/1255510713000513539,borismone,,2020-04-29 14:54:14+00:00,0,0,,,,"MORGAN STANLEY EXPECTS OIL PRICES TO STABILIZE AT WTI $40/BBL, BRENT $45/BBL IN 2021 https://twitter.com/FirstSquawk/status/1255493584536702976"
1255509311427616776,https://twitter.com/toomuch_bender/status/1255509311427616776,toomuch_bender,franchosa,2020-04-29 14:48:40+00:00,0,0,,,,"Coincido en todo. Morgan Stanley ya dijo antes de ayer que en el caso peor iba a rondar el 23% de caída. Y cayendo eso, nuestra deuda actual ya será del 120-130% del PIB sin contar la nueva que se genere ahora. Va a ser un puto infierno. Y van a aprovechar para no soltar el poder"
1255509198055575556,https://twitter.com/bankedits/status/1255509198055575556,bankedits,,2020-04-29 14:48:13+00:00,0,0,,,,2020 coronavirus pandemic in Hungary Wikipedia article edited anonymously from Morgan Stanley Group https://en.wikipedia.org/w/index.php?diff=953878923&amp;oldid=953823734
1255506090613264393,https://twitter.com/Traderideas1/status/1255506090613264393,Traderideas1,,2020-04-29 14:35:52+00:00,0,0,,,,"$CAT Morgan Stanley Lifts Price Target on Caterpillar to $95 From $93, Maintains Underweight"
1255504472115236864,https://twitter.com/MaisaCorp/status/1255504472115236864,MaisaCorp,,2020-04-29 14:29:26+00:00,0,0,,#WTI #Brent,,"$MS Morgan Stanley believes oil demand will not reach average 2019 levels until 2021, sees 2021 #WTI and #Brent prices stabilizing at $40/bbl and $45/bbl respectively"
1255504218120761349,https://twitter.com/RosaGoldensohn/status/1255504218120761349,RosaGoldensohn,LindseyBoylan,2020-04-29 14:28:26+00:00,14,26,,,,"One question is whether auctions are ongoing. Another, whether fees can be hiked right now. We covered this woman's story, she lost all but her bible to Morgan Stanley-owned Safeguard: https://twitter.com/LindseyBoylan/status/1255483728459112450 https://thecity.nyc/2019/06/victims-of-the-storage-wars-losing-all-to-auctions.html"
1255502989713907715,https://twitter.com/EconomiesCom/status/1255502989713907715,EconomiesCom,,2020-04-29 14:23:33+00:00,0,0,,,,"Morgan Stanley shakes off negative pressure - Analysis - 29-04-2020: Morgan Stanley's stock rose 2.09% in the last session amid positive signals from the RSI, while ... "
1255502987511959562,https://twitter.com/andremarinhoc/status/1255502987511959562,andremarinhoc,,2020-04-29 14:23:32+00:00,0,6,,,,"O PIB dos Estados Unidos encolheu 4,8% no primeiro trimestre de 2020, maior contração desde crise financeira de 2008. Mas pior ainda está por vir: atividade econômica americana pode tombar 38% no segundo trimestre, de acordo com previsão do Morgan Stanley."
1255501797730529280,https://twitter.com/BioStocks/status/1255501797730529280,BioStocks,,2020-04-29 14:18:49+00:00,1,1,,,,"$GILD news is as closer to our best case scenario - Morgan Stanley. Maintains Equalweight, PT $75 Read more at: https://thefly.com/landingPageNews.php?id=3081837"
1255500949579354115,https://twitter.com/BriefCity/status/1255500949579354115,BriefCity,,2020-04-29 14:15:27+00:00,0,1,,#Oil #WTI #Brent #Oil #Americas,,Morgan Stanley have recently announced that they expect #Oil prices to stabilise at $40/BBL for #WTI and $45/BBL for #Brent in 2021. This news may create an uptick in market volatility and risk within #Oil through the remainder of the #Americas session.
1255500698789253125,https://twitter.com/direct_finans/status/1255500698789253125,direct_finans,,2020-04-29 14:14:27+00:00,0,0,,,,"Morgan Stanley: -Petrol fiyatlarının 2021'de WTI'da 40 dolar/varil, Brent'te 45 dolar/varille dengelenmesini bekliyoruz -Yaklaşık 20 milyon varil/gün rafineri kapasitesi devre dışı"
1255500695308054529,https://twitter.com/direct_finans/status/1255500695308054529,direct_finans,,2020-04-29 14:14:26+00:00,0,0,,,,"Morgan Stanley: Petrol talebi, 2021'in dördüncü çeyreğine kadar 2019'un ortalama seviyesine ulaşmayacak"
